"","title","point","review"
"1","침묵","10","좋네요 흥행되진 않았지만 스토리 탄탄하고좋아요."
"2","다만 악에서 구하소서","9","재미로 보면 굿. 스토리로 보면 허술."
"3","지니어스 독","10","동물 키워본 사람이라면 공감할 구석이 많은 영화!"
"4","레드: 더 레전드","8","오 재미없을 거 같아서 안보고 있다가 급 보고 싶어서 봤네요. 나쁘지 않은듯. 이병헌 너무 좋아!!!"
"5","기기괴괴 성형수","10","원작 그대로 나온듯.. 진짜 기괴하다 추천"
"6","매트릭스","10","깨어나면 매트릭스가 현실인걸 알것이다"
"7","지니어스 독","10","개가 뭐 이리 연기를 잘해 ㅋㅋ 킬링타임 굿"
"8","다만 악에서 구하소서","10","연기와 액션이 좋음. 재미있게 볼수 있음"
"9","오케이 마담","8","그냥 적당한 킬링타임용."
"10","지니어스 독","9","단순 반려견이 아니라 가족이자 친구인 헨리와 올리버ㅠㅠ 힐링될 수밖에 없쟈나 솔직히"
"11","테넷","10","2틀 연속으로 두번 봤는데 여전히 장면의 이해가 어렵다. 그래도 재미는 있음."
"12","김복남 살인사건의 전말","10","넌. 너무 불친절햐...서영희님 연기최고였습니다다섯번은 본거같네요한국스릴러 역사상이런작품 드물다고 생각합니다"
"13","투모로우랜드","7","그때는 재밌었지만, 지금은 유치하다..."
"14","뉴 뮤턴트","9","볼만하네"
"15","23 아이덴티티","9","제임스 맥어보이는 진짜 ㄹㅈㄷ 안야 너무 예쁨.."
"16","다만 악에서 구하소서","10","황정민 박정민 연기략 좋구요박정민님 연기 상콤합니다이정재님 정말 집착쩌는 살인마 연기장난 아닙니다.영화를 연기력으로 본거 같아요"
"17","테넷","10","영화 다 보고 오빠 왈, “영화를 보러왔는데 왜 영화관을 나가고있지..”"
"18","고스트 라이더 3D : 복수의 화신","1","15분 보다 껐습니다.. 이게 영환가...?"
"19","다만 악에서 구하소서","6","이따위로 만들거면 만들지마라몬 영화가 스토리가 없냐 ㅡㅡ그냥 죽이기 땡"
"20","시간이탈자","6","이 영화의 제일 큰 실수는 80년대 학교상황을 조사하지 않고 제작했다는것.... 1983년부터는 전국이 교복자율화되어서 다 교복을 안 입었습니다. 근데 영화는 교복 계속 입고 있네요. 1983년에 중1이었는데 교복을 고등학교 졸업까지 못 입었습니다. 교복이 폐지되었거든요"
"21","강철비2: 정상회담","1","이걸 영화라고 만들엇냐 ㅋㅋㅋㅋ? 국가망신 수준 미달이네 다신 이런 영화 만들지마라 디워 급이네"
"22","가디언즈","10","아이들과 함께 보기에 최고의 영화에요. 이런 영화가 개봉했었는지도 몰랐었네요. 영상, 내용 구성 다 좋아요."
"23","테넷","10","역시 놀란 감독. 음악도 내내 너무 좋았고, 로버트 패틴슨 연기... 더 배트맨을 더욱 기대하게 만드는 영화. 진짜 간만의 역작"
"24","다만 악에서 구하소서","4","그냥 노잼. 보는 내내 한국영화네 라는 생각. 딱히 내가 영화를 잘알고 평론가도 아니지만 그냥 노잼이란 생각만듬. 보는 내내 지루함"
"25","오! 문희","10","나샘의 연기를 알기에 전혀 정보가 없었지만 믿고 봤다. 아들로 나오는 배우도 연기 알아주기에. 코믹이지만 울기도 했다. 치매를 나름 사실적으로 표현, 치매 노인을 모시는 가족의 고통과 긍정적인 모습.후자는  현실에선 드물꺼 같다. 그래도 좋았다. 희망메세지,정의,가족의 승리"
"26","작전","10","주식을 알고 보니 더 재밌는 그런 영화명화입니다. 10점"
"27","뉴 뮤턴트","1","커플끼리가면 두명이서 볼수있어서 아주좋아요 꼭보세요.온국미이 다봤으면좋겠네요"
"28","오! 문희","9","댓글 알바 아니구요 ㅎㅎ 저는 즐겁게 봤어요 치매를 소재로 해서 조금 마음아픈 부분도 있었지만연기도 잘하시고 웃으며 봤습니다."
"29","흥부: 글로 세상을 바꾼 자","1","감독이 역사책을 읽어 본 적이 없나? 너무나 괴랄한 민중봉기담.대비마마가 섹시댄스 출까봐 내가  걱정해야 하는 이유는?"
"30","기기괴괴 성형수","10","3D라서 좀 부자연스러웠고 성우연기와 조금 어울리지 않는 느낌이지만 재밌게 잘 봤다.마지막 쫓길 때 회상씬은 진짜 슬펐다.원작보다 잘 각색한 부분도 있고 조금 부족한 부분도 있었지만 국산 애니메이션으로 이렇게 고연령층을 위한 작품이 나왔다는 것으로 만족한다.+15세 치고 진짜 잔인하니까 마음 졸이면서 보는 거 추천ㅠ"
"31","내가 사랑했던 모든 남자들에게","10","스토리도 좋았고 ㅠㅠ 연기도 다 좋았다 설렘 폭탄이야... 지금껏 본 하이틴 영화중에 탑투에 들듯 너무 만족스럽고 재밌었다"
"32","테넷","10","진짜..보면서 소름돋았다. 러닝타임이길지만 전혀지루하지않고 대신 영화가 좀 어렵긴하지만 계속 집중해서보게된다."
"33","엔젤 오브 마인","10","재밌었다 .반전의 반전"
"34","오! 문희","6","배우들 연기 좋음. 스토리 라인은 충분히 예상 가능한 정도. 나름대로 현실을 반영하고 있음. 가볍게 코미디 영화로 볼만한데 멧돼지 CG는 좀 깼음..."
"35","가장 보통의 연애","10","소소한 일상의 연애이야기"
"36","테넷","10","이런걸 생각해낸 감독이 진짜 대단한것 같다 인셉션 이흐로 영화가 끝나고도 여운이 이렇게 길게 남는 영화는  오랜만인것 같다"
"37","사탄의 베이비 시터: 킬러 퀸","10","화끈한 B급 액션 호러 코미디"
"38","테넷","10","와 이건 대박이다.. 또보고싶다"
"39","테넷","9","매번 영화계를 한단계 높여주는 놀란감독체험영화의 극치"
"40","윤희에게","10","영화의 잔잔함과 배우들의 연기에 반해버렸습니다.. 레즈비언 소재지만 느껴지지 않을만큼, 잔잔하고 감동있는 영화라고 생각됩니다~ 추천."
"41","내가 사랑했던 모든 남자들에게: P.S. 여전히 널 사랑해","6","그냥저냥 볼만했다"
"42","내가 사랑했던 모든 남자들에게","8","풋과일 같은 상큼한 로맨틱 스토리"
"43","말모이","10","지켜주셔서 감사합니다."
"44","극장판 마법소녀 마도카 마기카(신편): 반역의 이야기","10","평점 테러로 인해 10점줌 원래는 많아야 8점 정도"
"45","#살아있다","2","적당히 합시다 진짜로 ㅋ"
"46","마이 걸","10","애는 안경없으면  못본다 말이예요..."
"47","기기괴괴 성형수","9","진짜 잘만들었다고 생각함"
"48","다만 악에서 구하소서","6","이정재와 황정민사이는 달콤한 인생에서 탑과 이병헌의 관계, 애기 구하는 과정은 아저씨.이정재 연기는 좋네요.황정민 액션은 의외긴한데둘의조합이 신세계 느낌이랑 달라서 좋았네요박정민은 연기 귀엽게 잘하네요.스토리는4점연기는8.9연출은5점"
"49","23 아이덴티티","8","제임스 맥어보이가 다한 영화 2시간은 금방 감... ㅋㅋㅋ 연기 덕분에"
"50","추억의 마니","10","사춘기 소녀의 정신적 성장을 도와준 마니..  다 보고나서 눈물조금 흘렸네요ㅠㅠ"
"51","다만 악에서 구하소서","1","다만 이 감독좀 구해줘. 이걸 영화라고"
"52","라이트하우스","10","걍 봐라 존말할때 로버트 패티슨 읠리엄 데포는 연기를 아주 잘한다 이보다 봐야할 이유가 어디있단 말임?"
"53","퇴마 포송령: 천녀유혼전","4","계속 만들다 보면 언젠간 CG가 빛을 발하는 날이 오게 될까?"
"54","#살아있다","1","진짜 진짜 재미없다 하하하하"
"55","마더","10","언더도그마의 언더도그마, 그들에게 부족했던 건 돈이나 배움이 아니였을 것이다. 다만 무언가가 넘쳐흘렀을 뿐"
"56","다만 악에서 구하소서","6","필요이상으로 잔인하고 유혈낭자하다.영화는 글쎄 티미하다."
"57","테넷","10","갓놀란.. n차 관람 다짐하며 봤습니다 이런 감독과 동시대에 살고있다는게 큰 축복이라고 생각됩니다"
"58","올드 가드","10","넷플릭스 영화 중 손에 꼽힐만한 명작"
"59","강철비2: 정상회담","10","여기는 대한민국  영해입니다~"
"60","서스페리아","8","하.. 다른 감독 영화지만 미드소마를 먼저 봐서.. 기괴함이 덜 하네요"
"61","붉은 가족","9","응? 이건 무슨영화지? 이런영화가있었나? 심심한데 잠깐만보다가 잼없음 다른거봐야지...했다가 다보고 다시 마지막장면돌려보고 이렇게 댓글쓰고있음... 이런영화가 살아야하는데...안탑깝네... 지루하지않게 잘 봤고 다시금 북한공작원의 삶에 생각하게하는영화"
"62","원스 어폰 어 타임... 인 할리우드","6","레오 찌질한 연기 너무 잘 봤는데 아니 무슨 영화 줄거리 소개란에 있는 내용을 2시간동안이나 해요..이 감독 영화 본 적도 없고 배경지식도 없고 할리우드에 추억도 없어서 걍 ???한 영화였음근데 평점을 보니 추모의 의미도 있고 이 감독 영화를 오마주한 장면도 있다고 이런 것들을 알고있다면 재미는 있었겠지만 전 없었네요.. 그리고 너무 잔인해"
"63","#살아있다","6","다른 좀비 영화처럼 스케일이 크진 않는데실제 좀비가 나오면 평범한 사람들은 이렇게 행동할것같다 라는 생각을 하며감정이입하며 봄 기대 안하고 킬링타임용으로보면 볼만함"
"64","나를 찾아줘","8","평점이 너무 낮아 미뤘는데... 내용이 참...  찝찝한 스토리이며 영상도 얼추 비슷하게 잘 표현된거 같지만 연출부분이 그닥! 그 안에 지루함도 다소 존재하고! 낚시터 조연들의 연기 좋았음 그중 한명이 다소 과해서 분위기 흔들흔들, 유재명 연기 무서웠음, 이영애의 연기가 사치스럽지 않고 애절했으며 드라마보단 영화속에서의 절제된 연기가 그녀의 참이라 생각했음!"
"65","스파이","5","노잼중 최고노잼 속지마시길"
"66","허스토리","2","됐고요, 허스토리의 첫 잘못은 김희애씨 캐릭터의 스타일입니다. 딱 처음 봤을때부터 어색한 가발같은 단발머리에 커사튬같은 오버스러운 사각 안경태.. 정말 부자연스러움의 끝입니다."
"67","극한직업","2","이 영화보고 인생 배웠습니다 아.. 운이 중요하구나내가 실력이 좀 부족해도 운만 좋으면 대박날수있구나"
"68","사이비","2","사이비를 빙자한 정권까는 용도 그이상 그이하도 아님 장로는 mb 신문에 사대강 ㅎㅎ 2점도 아깝다"
"69","곡성(哭聲)","2","이게 무섭다고? 작품성이 있다고? 사람들을 자극할만한 불쾌한 요소 덕지덕지 발라놓고 흠.. 이쯤되면벌벌 떨겠지 하며 즐기고 있는 듯한 느낌임 시골마을에 대대로 내려오는 시골괴담을 짜집기해서 영화 만든것같은데 옛날 토요미스테리가 더 메세지 확실하고 잼나네요"
"70","뉴 뮤턴트","3","새롭게 이어나가지 못하고 끊겼다."
"71","다만 악에서 구하소서","10","14900원주고 방금 봤는데 돈 아깝지 않음..결말이 좀 달라다면 맘이 더 좋았을텐데ㅋㅋ박정민 칭찬이 많은데 인정하고 액션도 좋았음"
"72","피터팬","10","언제나 주변에도 말하고 그냥 말하지만 피터팬 2003년 작품은 정말로 정말로 5살때부터 스무 살인 지금까지여전히 내 인생작품 내 영원한 피터팬내 영원한 첫사랑 보고 또 봐도 최고야"
"73","#살아있다","2","욕나온다 욕나온다 또 욕나온다."
"74","버닝","1","..  영화를 공부로 생각하며  이 영화를 통해 무언가를 쳐느껴보려고 돋보기끼고 보는 극소수가 10점을 주는 듯 하다..  사람의 심리??  그냥 일기로 써라.  이걸 돈주고 보게하냐.. 욕이나오네..  예술이라 평하는 ㅂㅅ들이 더 문제다...  더러워.."
"75","다만 악에서 구하소서","6","킬링타임용 외국에서 찍은 아저씨 느낌다만 스토리가 빈약"
"76","굿모닝 에브리원","8","인생 목표에에 동기부여가 되는 영화"
"77","강철비2: 정상회담","2","말도 안되는게 첫째인데 완전 보면서 짜증나... 아니 힘없는 나라라고 강조하는 것같음.개 열받아."
"78","파퍼씨네 펭귄들","10","그냥 하염없이 눈물만 나... 그냥 하염없이 서글퍼져... ㅠㅜ 갓띵작... 실화냐?...나는...펭귄들 평생 못잊는다...파퍼씨 펭귄 다시 만난거 인증샷 부탁드려요 제발 여행일지남겨"
"79","다만 악에서 구하소서","2","걍 재미없음  황정민 연기 못함. 이정재 연기는 좋은데..스토리가 너무 억지라..아무튼 시간 아까움."
"80","파퍼씨네 펭귄들","10","보다가 울었어요,, 갓띵작 정신못차리겠어~"
"81","테넷","10","알고나면 정말 치밀하게 짜여진 영화"
"82","돈 워리","6","현실적을 잘 만들었네요. 이 나라도 연예인 알콜광고 내보내지말고, 심각성을 깨달았으면 하네요. 멈추던가 마시던가 두개만 있죠. 알콜은 죽어야 끝나는 병입니다.  평범한 하루에 감사할줄 알자..."
"83","다만 악에서 구하소서","10","스토리가 없다는 둥 기대이하라는 둥 니들이 스토리 짜서 찍어봐요 그럼 얼마나 잘 만드나보게 좀 꼭 볼껀 다보고 뒷말들은...ㅉㅉㅉ"
"84","테넷","10","진짜 ㅈㄴ 재밌음 꼭 보셈 진짜 보고 감탄 했다 진짜로 진짜 복선이 장난이니고 아 걍 꼭 봐주세요 부탁이에요 진짜 존나 재밌어서 ㅈㄴ 흥분 돼오 OO 진짜 한 번 더 볼겁니다 인셉션 보고 난 후 알게 된 것 . 한 장면 하나하나 놓치지 마시고 꼭 보세요"
"85","베스트셀러","6","초중반 흥미롭고 반전도 있었는데 결말 갈수록 너무 억지스럽고기가차네"
"86","먼 훗날 우리","10","보고싶고 다시 그때로 돌아가고 싶어도... 이제는 그냥 가슴속에 묻어야하는...왜 이제와서 너란 사람이 소중했다는걸 깨달은걸까...딱 한마디라도 그녀에게 전해졌으면... 미안해..."
"87","내가 사랑했던 모든 남자들에게","10","안볼려했다가 많은분들이 보셔서 봤는데 꿀잼 원래 로맨스 안좋아하는편인데 잼나게 봤어요ㅎㅎㅎㅎ"
"88","한낮의 유성","10","아윽흑이게뭐에요 누가찐남주여도 슬퍼 진짜 짜증나 작가님 감독님 그냥 둘다만나면안돼요?"
"89","마이보이","8","마지막 드럼 장면의 기억을 지울수없다.."
"90","기다리다 미쳐","10","기가 막힌 타이밍.당신의 경험에 같은 시점에 같은 경험을 말하는 영화가 있으신가요?전 운좋게 이 영화 입니다.연출, 완성 필요 없이 추억 한가운데 자리 잡는 영화가 있더군요.저에겐 그게 이 영화 입니다.감사했습니다. 지금도 생각나게 해서"
"91","테넷","8","창의적인 미래가 아닌 보여주기 위한 쇼를 준비한 놀란. 놀란답지 않은 허점있는 전개였지만 그럼에도 많은 장점이 있는 작품이다. 촬영상은 보너스!"
"92","다만 악에서 구하소서","2","정말 5점 이하의 점수가 솔직한 리뷰임.배우들이 아깝고, 설마설마 했는데 '요란한 빈수레' 끝!"
"93","어벤져스: 엔드게임","7","아이언맨은 좋아하지만 마지막 감동까지 그 과정이 그렇게 와닿진 않았네요"
"94","극장판 원피스 스탬피드","6","캐릭터란 캐릭터는 다 때려박은거같음활약이 없는 몇몇 캐릭터들이 아쉬움"
"95","어벤져스: 인피니티 워","10","타노스와의 액션신은 제가 본 히어로물 중 최고에요"
"96","#살아있다","1","이 영화는 리뷰가 개꿀잼임ㅋㅋ반응 다똑같애"
"97","로마의 휴일","10","기대 안 했는데킬링타임용으로 좋아요웃음과 감동이 있습니다"
"98","아메리칸 싸이코","10","뭔가 짐캐리연기같기도하고, 매튜맥커너히랑 대단히 닮은 느낌도나고. 크리스찬 베일은 얼굴이 진짜 다양하다."
"99","황해","10","황해 트럭 전복씬 >>>> 다크나이트 트럭 전복씬"
"100","황해","10","김윤석은 아저씨에 원빈보다 센듯."
"101","테넷","10","미쳤다 라는 말밖엔... 그저 갓. 그나저나 엔딩 닐 너무 멋짐"
"102","겟 스마트","10","두 주연의 캐릭터가 잘 맞음. 보는 내내 미소지으며 본 영화."
"103","드림캐쳐","1","이게머야OO ㅠㅜ 반전있다더니 그냥 영화 보면 유추할수 있는거고,,시간아까우니 딴거보시길"
"104","인비저블 게스트","10","마지막장면 ...또봐도대단"
"105","카메라를 멈추면 안 돼!","9","ㅋx100"
"106","나는 전설이다","7","급전개가 다소 아쉬웠지만 여운이 남는다!!"
"107","지푸라기라도 잡고 싶은 짐승들","8","시간가는줄 모르고 재밌게 봤어요.. 스릴있고 배우들 연기력도 좋고 좋았어요"
"108","테넷","6","평점 허세들 보면 짜증난다 ㅡㅡ 이해안되어서 한번더 보는거지 재밌어서 한번더 보는건 아닌거 같다.뿌린 떡밥이 딱딱 맞아 떨어질때 영화의 재미가 더 해지는데 뭐 맞아 떨어져도 절반 이상이 이해가 안가니 재미도 없고.. 한번더 볼만한 영화는 아님 두번본다고 이해 될거 같지도 않고"
"109","50가지 그림자: 해방","10","오 이렇게 마무리가 되는구만"
"110","에이리언 VS. 프레데터 2","5","전작을 말아먹은 후속작!"
"111","82년생 김지영","10","이 영화를 보기전에는 편견을 가지고 봤지만 본 후에는 정말 많은 생각이 드는 영화"
"112","롤러코스터","10","하정우 감독님 응원합니다~~~"
"113","뉴 뮤턴트","6","중반까진 그러려니 했는데 후반보고 읭 스러웠음 그냥 일리아나 역할이 매력있다는게 기억에 남음 그저 웃음뿐..ㅎㅎ"
"114","너의 결혼식","10","아무리첫사랑이래도 여친있는데 그렇게 둘이시간보내는게 맘에안들긴하지만 김영광 얼굴이 다함 ㅎㅎ 결말도맘에듬 그래서 너의 결혼식이구나"
"115","본 레거시","7","이렇다할 주제도 목적성도 없고 그렇다고 긴박하고 화끈한 액션이 있는 것도 아니다. 기존 시리즈와 별개로 보려해도 내용 전개에 전혀 상관없는 ""제이슨 본"" 내용을 굳이 삽입해버리니 런닝타임 중에도 비교만 될 뿐"
"116","#살아있다","1","이 영화를 볼 바엔 부산행을 240p로 다시 보는 게 낫습니다. 물론 부산행도 그리 훌륭한 작품에 속하진 않습니다."
"117","나를 구하지 마세요","10","잔잔한감동이 있어요요즘시대다들힘들게사는데 다시한번 삶의중요성을 깨우쳐주는 영화입니다아이들의 연기도 영화를보는재미에 또하나의 요소같아요영화가 끝나고 전체적은 맑은 배경이 아직도 기억에 남아요"
"118","반도","10","정신없지만 재밌는데!! 너무 많은 걸 보여주려고 한 감은 있지만 재밌다!!!"
"119","시몬","8","하긴 컴퓨터로 만들면 완벽한 모습을 만들수 있고 또한 감독이 원하는 연기를 100% 소화 가능하지"
"120","다만 악에서 구하소서","10","재밌어요 !!코로나아니었음 천만 넘었겠네여 ㅠ 이영화 ㅎㅎ!! 여튼 전 정말 재밌게 봤습니다~~!!"
"121","#살아있다","1","배우가 아깝다진짜와 영화보고 댓글처음남김 개쌉노잼대체 무엇을위한영화인가."
"122","다만 악에서 구하소서","1","진짜 평점에 속았다... 개연성이라곤 없고 무슨 슈퍼맨 배트맨 마냥 총 칼 맞고 날라다니는게 너무 비현실적이다 진짜 올해 본 영화 중에 최악..."
"123","버드맨","10","말이 필요없다 최고다!!"
"124","#살아있다","2","영화관 못가게 한 코로나가 고마울줄이야..."
"125","인터스텔라","10","인간의 발전을 세시간 내로 압축시킨 작품"
"126","인터스텔라","10","내인생 최고의 영화~인터스텔라 2 제발  나오기를~"
"127","월드워Z","9","잼네요 2013년작인데 우리나라 좀비영화보다 훨 잘 만들었네요"
"128","무서운 집","10","오ㅐ 기생충을 못이겼을까? 세계의미스터리다."
"129","인터스텔라","10","볼때마다 정말 놀랍다.."
"130","롱 리브 더 킹: 목포 영웅","10","보고또봐도 너무 재밌쪄~~~ 사랑한다는말~너무 흔해서 하기싫은말~"
"131","롱 리브 더 킹: 목포 영웅","10","너무재밌게봤어요♡♡♡♡"
"132","반도","4","신파도 이런 신파극이 없네"
"133","뉴 뮤턴트","2","존나짜증나네진짜내시간과돈을돌려내라"
"134","애니멀 크래커","6","8살 아들이 보고싶은 영화라해서 보여줬는데 아들은 재밌게 봤고 엄마입장에선 좀 별루네요...진짜 별루....스토리도 약하고...교육적이지도 교훈적이지도 않아요"
"135","테넷","6","머리 나쁜 나에겐 매우 어려운 내용임 ㅜㅜ"
"136","터널","10","집에서 봤는데 진짜 재미있었음.영화는 다 좋고 긴장감도 있고 진짜 인생영화였는데 터널 공포증이 생겼다..."
"137","터널","10","집에서 봤는데 진짜 재미있었음.영화는 다 좋고 긴장감도 있고 진짜 인생영화였는데 터널 공포증이 생겼다..."
"138","카일라스 가는 길","2","기대가 너무 컸던가 봅니다 ?소재는 훌륭했으나, 영상도 스토리 편집도 많이 아쉬웠고 지루했어요~"
"139","여중생A","1","제가 웬만하면 평가를 안 남기는데 최근에 여자친구때문에 봤습니다. 진짜 최악중에 최악이네요... 감독님의 자질이 심히 문제가 있을만큼요. 영화라고 부르기도 민망한 작품입니다. 좋은 원작내용을 가지고 이정도 밖에 만들지 못한거는 진짜 심각합니다.. 본 작품의 감독님 작품은 아마 두 번 다시 안볼것 같네요;;;"
"140","기기괴괴 성형수","1","이걸 만든 제작사도, 애써 평점 관리를 해주고 있는 네이버도, 둘 다 쪽팔리는 줄 알아야 할 희대의 망작. 감상 포인트를 고르라는데, '없음' 선택지도 하나 만들어줘야 하는 게 양심적이지 않을까?"
"141","#살아있다","1","감사합니다. 덕분에 인강이 재밌어졌어요!"
"142","이장","9","올 추석에 가족과함께 집에서볼만한 영화입니다  금연중인 분들은 힘드실것같아요ㅎㅎ"
"143","콜 미 바이 유어 네임","10","난 분명 모쏠인데 왜 나의 첫사랑이 떠오르는거 같지..? 그보다 난 왜 이 영화를 2년이나 지나고서야 알게된걸까..."
"144","기기괴괴 성형수","1","모션이 진짜 별로임... 마네킹 움직이는 느낌....진짜 평점 작업하는거 역겹다.."
"145","걸캅스","10","진짜 말이 필요 없다 최고"
"146","오! 문희","10","웃겼다가 슬펐다가 웃겼다가 슬펐다가 계속 반복한다.. 떡밥 회수를 잘해서 영화가 탄탄하다고 느껴졌고 연기는 뭐 말할 것도 없다. 오랜만에 엄마랑 재밌는 영화를 봐서 좋았다."
"147","반도","1","하하하....죄송합니다 너무 재미가 없어요..."
"148","테넷","2","코로나에 개봉한 이유를 찾았다..이렇게 잼없는 영화를 알바로 평점을...결말도 안보고 나온영화,,내돈주고 봤으면 억울할뻔~안보신분들 그냥 안보는게 정신건강에 좋습니다~~"
"149","화이 : 괴물을 삼킨 아이","10","여러번 볼수록 새로운 영화"
"150","#살아있다","6","시나리오 단계에서는 좋았을 거 같은데.. 영상으로 만들고 배치하는 과정에서 전개가 너무 길어진 거 아닐까?"
"151","26년","10","최고다 이영화는 정말로"
"152","테넷","10","액션은짱인데 넘 어려워용 ㅜㅜ ㅎㅎ 그치만 한번쯤 보시는거 추천욥"
"153","다만 악에서 구하소서","2","배우와 시간이 아까움.돈이 아까움."
"154","부당거래","6","도입부와 과정은 좋았는데 결말이 매우 조잡하다"
"155","피케이: 별에서 온 얼간이","9","종교의 모순점을 통쾌하게 찌르는 단순명쾌한 대사들 맘에 든다"
"156","다만 악에서 구하소서","9","다만 악으로부터 구한것은 박정민인걸까? 맞든 아니든, 왜 다들 그를 두고 극찬했는지 알거 같았다. 센 액션들이 넘쳐나고 이정재, 황정민 배우님 역시 열연을 보여주셨음에도 가장 기억에 남는 배우는 박정민 그였다."
"157","테넷","10","역시 킹놀란. 아예 이해가 안되지는 않고, 보다보면 아~하는 구간이 몇번이나 나온다. 몇 번이나 재관람해도 아깝지 않을 정도의 수작이다."
"158","언어의 정원","10","언어의 정원은 최고다 무슨 말이 필요한가"
"159","강남 1970","10","정말 재미있게 봤습니다. 긴 여운이 남네요.."
"160","텍사스 전기톱 연쇄살인사건","10","재미있게 잘 봤어요 텍사스 전기톱2 나왔으연 좋겠네요.."
"161","다만 악에서 구하소서","8","가족과함께 즐거운시간을  보낼수잇는  영화엿어요^^"
"162","하우스 오브 왁스","10","고3때 너무 재밌게 본 공포영화ㅜ스토리며 연기자들 모든게 다잼났음"
