"","title","point","review"
"163","다만 악에서 구하소서","6","This is from Matilda"
"164","인썸니아","8","명감독의 명배우. 띵작!!"
"165","마녀","10","김다미의 발견...."
"166","신데렐라","6","신세경 진짜 너무 예쁘더라ㅠ지금과  똑같아 오히려 더 예쁜거같아진짜 자연미인 임"
"167","악마를 보았다","10","한국영화 본것중 탑5에드는영화"
"168","마약왕","9","저평가된 영화라 생각합니다. 재밌습니다."
"169","미드나잇 인 파리","2","파리 특유의 감성, 배경이 아름다워서도입부가 엄청 황홀하고 끌리는 영화.근데 15~30분 넘어가면 지루한 영화 세상 처음 졸리는 영화..."
"170","다만 악에서 구하소서","5","맨온파이어+아저씨+라스트오브어스+기타등등=뻔한스토리. 액션때문에 5점줌. 그리고 박정민이 누군데??"
"171","베이비 드라이버","6","재주좋은 베이비가 골라준 음악과 리듬타는 법."
"172","뉴 뮤턴트","2","역대급 별로임. 동성애는 뜬금포. 개연성 1도없고 ‘스탑.노우~.’에 모든것이 끝난 영화"
"173","탐정 : 더 비기닝","8","하도 평이 좋아서 너무 기대를 했나 ㅋㅋㅋ 스토리는 괜찮았는데 조연 중에 어색한 연기톤들이 몇몇 보여서 아쉬웠다. 하지만 b급 영화로 생각하면 딱 맞는 느낌 ㅎ 그나름의 매력이 있음.."
"174","다크 나이트","10","진실만으로 살아남는 세상이 되야한다. 와이쏘시리어스 조커의 물음에 대답은 심각하니깐 심각한거다."
"175","한반도","2","'고산자 대동여지도'와 더붙어 강우석 감독이 싸지른 가장 큰 똥"
"176","시간위의 집","9","재밌게 잘보았어요. 효재걱정에 눈물이....ㅜㅠ"
"177","반쪽의 이야기","9","구조속에 운명 그러니까 망가져야 하는 그림을 극복하고 더 좋은  완성도를 위해"
"178","태백권","1","오지호 사채 썼나? 암거나 막 찍는거 같다."
"179","태백권","2","오지호 영화말고 내조의여왕 같은 유부남 역할 드라마 찍자.."
"180","쏘우","10","진짜 반전 대박... 지금이야 다 스포로 알려져있지만 처음봤을때 충격을 잊을수없네요"
"181","불량남녀","6","달리기론 이봉주한테도 안진대 ㅎㅎ"
"182","테스와 보낸 여름","8","생각이 많다면 조금은 덜수 있는, 공허하다면 조금은 채워지는, 여운보다 순간이 따듯한 영화"
"183","너를 만난 여름","8","또 한번의 여름이 왔어. 가끔은 내 생각이 나니?"
"184","월플라워","10","다시봐도 역시 좋다"
"185","반도","9","재밌어요"
"186","포드 V 페라리","10","김현수 평론가님 정말 이 영화가 그렇게 간단한 내용을 담고 있는 영화로 보이시는건가요..."
"187","다만 악에서 구하소서","9","재밌어요"
"188","#살아있다","2","절대..보기드문 쓰레기영화.."
"189","오! 문희","1","알바하면 돈 얼마줌 어이가 없어서 눈은 뒀다가 돈에 영혼까지 팔지 ㅋㅋㅋ씹닥구리 개노잼 영화에다가 ㅋㅋㅋㅋ"
"190","강철비2: 정상회담","10","정우성 이랑 일면이 없어서 그러는데요인중에 상처는 먼가요?잘안보이지만 자세히 보면 보임"
"191","딥워터 호라이즌","10","이런 사실에 근거한 영화들이 나는 좋다"
"192","나를 구하지 마세요","10","가슴이 무너지는 것 같았어요.. 너무 빨리 커버린 아이.. 행복하자 부디"
"193","모정","9","마크가 한국전 때문에 죽었으니까 수인은 김일성의살점이라도 씹어먹고 싶을껄?"
"194","페니 핀처","10","소소한 재미가 있는 수작"
"195","기기괴괴 성형수","8","제목 그대로 기기괴괴했구요 별 기대없이 봤는데 생각보다 볼만했어요 돈 아깝지는 않을정도에요"
"196","기기괴괴 성형수","1","아니 엄마 아빠는 ? 밑도 끝도 없이 끝나네 ,,"
"197","작은 아씨들","10","끊임없이 의심하고 두려워하지만, 결국 아름다웠을 모든 사람들에게.."
"198","몽상가들","10","파리에서의 마지막 탱고는 강간&성폭행이라고 발작하면서 쓰리썸은 아름다운 사랑이라는 페미들~내로남불은 그들이 누리는 특권이거나 정신병이라고 봐야지"
"199","먼 훗날 우리","10","청춘은 가장 아름답고 가장 쓰디 쓴 순간인 것 같다. 조금 지나온 나의 청춘은 후회 덩어리지만 시간은 아직 많이 남았으니 나의 청춘이 후회 말고 활짝 핀 추억으로 남길 ."
"200","다만 악에서 구하소서","8","절대 평가로는 단순하게 힘 빼서 잘 만든 상업영화다. 만화같은 스토리와 액션연출이 충분히 재미있다. 박정민 연기는 압권이었고 황정민의 얼굴은 진짜였다. 그리고 상대 평가로 들어가면 아주 고평가할만한게 최근 줄기차게 말아먹은 대작들과 비교해서다. 괜히 되지않는 연출력으로 이런 저런 영화 짬뽕해서 이도저도 아닌 맹탕 영화보다는 테이큰처럼 장르에 철저히 충실하면서 너무나 익숙하지만 확실한 재미를 보장하는 이런 영화가 지금 한국의 영화시장엔 더욱 필요해 보인다."
"201","기기괴괴 성형수","1","하... 내 돈....머리아픔"
"202","다만 악에서 구하소서","7","알파치노의 '칼리토' 리메이크임 여러곳에서 오마주 또는 차용한 부분이 보임 파나마부터 시작해서.. 마지막 휴양지 액자씬까지 이정재 캐릭터가 국내 영화에는 없던 모습이라 신선했음 중반 이후로는 영화의 긴장도가 늘어짐 2명의 주인공이 너무 초인적이라 그런 듯 최근의 넷플릭스 인간수업도 '칼리토'를 기반으로 함 낙원으로 사랑하는 여인과 도피할 꿈을 꾸지만 결국"
"203","기기괴괴 성형수","1","돈아까움 제발 도망치세요 영화관에 발도들이지마세요 연출 스토리 하나도 맘에안듬"
"204","에이바","1","스티븐시걸이 나타나서 에이바의 목을 꺾었다면 10점짜리 영화였을 것."
"205","지금 만나러 갑니다","8","눈물날 정도로 감동적이였어요"
"206","기기괴괴 성형수","10","그저 사랑받고 싶었을 뿐인데..?"
"207","클리프행어","10","이 스토리로 이정도면 갓명작이다"
"208","기기괴괴 성형수","4","감동도 없고 진부한 대사에 어색한 움직임 아이쿠 내돈 내놔라~~~~"
"209","블랙 호크 다운","10","전쟁영화를 보려면 이걸 봐라전쟁, 군인, 생명에 대해 생각해보게 된다"
"210","다만 악에서 구하소서","10","영화는 재밌으면 된다. 고생해서 찍은 모습이 영상에 다 들어나 있음"
"211","퍼펙트 게임","10","조승우배우... 이제서야 조승우한테 빠져서  그의 작품 몰아보느라  본의아니게 바쁘게 살고있네 ㅎㅎ  최동원을 연기하는 조승우 정말정말 멋지다"
"212","그 남자는 거기 없었다","10","진실과 해석의 차이"
"213","반도","2","여러 영화 뒤섞어서 결국 똥을 만들어냈다...고생했겠지만 한심한 영화...감상포인트 따위없다"
"214","스타워즈: 라이즈 오브 스카이워커","1","개연성이라고는 다 갖다버린 스토리중2병 넘치고 앞뒤가 안맞는 대사중국 무협영화같은 액션아침드라마수준의 등장인물관계"
"215","택시운전사","10","이걸 이제보다니.. 여운이남네요.."
"216","세상을 바꾼 변호인","10","가슴이 웅장해지는 영화였습니다."
"217","카모메 식당","8","공짜 커피를 마시는 핀란드 청년에서 핀란드가 여유로워보이는 이유를 찾은 일본인일까? ㅋ 허례허식...사회의 시선 역할 부담... 과도한 친절의 책임감을 벗어나 유연하고 싶지만 역설적으로 일상의 루틴과 일본의 전통과 긍지를 더  드러내고 싶은 일본인들?"
"218","특종: 량첸살인기","1","도저히 보기 힘들어 스킵하면서 빠르게 본 영화평점 보고 생각과는 너무 높아서 깜짝 놀란 영화....5년전 감성이라기에는 후..."
"219","리:본","10","누가 뭐래도 술안주용으로 딱이었음. 액션도 멋있기만 하던데오늘 또 볼꺼임"
"220","다만 악에서 구하소서","6","태국에 왠 연변출신 매반이..."
"221","연가시","1","시나리오는 좋은데 연출을 못한 케이스."
"222","퍼스트맨","10","달에 착륙한 후 문을 열었을때 나오는 그 정적은 진짜 말로 표현할수가 없다. 빠른 전개와 팡팡 터지는 오락영화를 좋아하는 한국인들의 정서에는 안맞을수 있으니 참고하고 봐라"
"223","에픽 : 숲속의 전설","10","어렸을 때 봤던 영화 중 가장 감명깊게 봐서 아직도 기억하는 영화. 누가 무슨 영화를 가장 재밌게 봤냐 그러면 아직도 이 영화 제목을 얘기한다"
"224","연가시","8","현실이 영화보다 더 무섭다. 영화에선 약을 미리 만들고 숨기고 정부상대로 장사를 할려는건데 현재 우한폐렴이 영화 속 연가시처럼 만들어놓고 팔려던걸 바이러스조차 완성도 안해놓고 심지어 약도 없는데 유출이 됨 당연히 현시점에선 실수로 유출된게 맞음 만약 바이러스가 완성했다면? 영화만큼 극단적이진 않았겠지만 상상만해도 소름끼친다. 딱히 영화가 허점이 많긴하지만 충분히 현실에선 가능한 부분이 꽤 들어있다 이걸 의도한건지 그냥 어쩌다보니 들어맞았는지는 모르나 자연재해보다 인간이 더 무서움"
"225","극장판 짱구는 못말려: 신혼여행 허리케인~ 사라진 아빠!","10","아빠가 꽃을 사고 달려가는 장면에서는 제가 다 설렜어요 ost부분들도 너무 좋았고 아빠의 보물을 얘기하는 장면이나 짱구가 그럼 엄마는 누가 지켜줘?에서 소리질렀네요ㅠㅠ"
"226","캣츠","1","현재 중학교 3학년이고 이걸 볼 때는 2학년이었습니다. 학교 예산이 남았는지 어떤지는 모르지만 학생회 일부가 단체관람을 하려고 갔는데... 50명 정도 가서 49명 잤습니다. 저 혼자 살아남았습니다. 그거도 팝콘 세트 다 못 먹을까봐 깨 있던 겁니다."
"227","하워즈 엔드","3","이거 보다가 진짜 재미없어서 껐는데 ㅋㅋㅋ 요즘 시각으로 보면 스토리가 잘 이해안감"
"228","용길이네 곱창집","1","자식들이 피가 더러운건지 불륜.이혼.상간은 기본탑재했네..한놈은 정신병자..시간 아까운 영화다..피와뼈는 얻어걸린듯..오모니 영화가 손나 재미없어요"
"229","뉴 뮤턴트","8","아우 너무 유치한데 또 그게 재밌엌ㅋㅋㅋ일리야나 너무 멋지고ㅠ 마블이 또 시대를 부족하게라도 읽는지 커플링 너무 좋구요^^"
"230","#살아있다","6","박신혜 연기 늘 너무 똑같아서 안타깝다 영화는 볼만했는데 엔딩이 너무 촌스러웠음"
"231","테넷","7","긴장감 있는 액션 지루하지 않아 좋았는데 내용이 어렵다..넘 어려워~"
"232","연가시","2","설정을 이따구로;;심각"
"233","엘리시움","10","' 이제 엘리시움의 주인이 누구게??? '"
"234","연가시","1","갑갑한 스토리와 비현실성과 주연남자캐릭터의 ㅈ같은 말투의 콜라보. 가족들이랑 통화할때마다 말투 땜에 더 빡침;;"
"235","다만 악에서 구하소서","1","한국 영화판의 현실이지  스토리는 산으로 가고 그냥 배우 명함만으로 막 영화를 찍어내는구나"
"236","인터스텔라","10","놀란 감독과 명배우들, 그리고 한스짐머의 미칠듯한 콜라보"
"237","#살아있다","1","연기가 너무 어색하고리얼리티가 떨어짐"
"238","기기괴괴 성형수","1","일단 이걸 보신다면 이 영화라고 볼수있나?라고 말이 나올 성형수 보지마세요진짜 ㄹㅇ 노잼 스토리 극악무섭지도 않은 유아용 영화뭔 내용인지 귀에 들어오지도 않습니다일본에서 만들었다면 몇배좋은 퀄리티가 나왔을건데 역시 한국 애니는 믿고 거릅니다또 속았네요"
"239","반도","2","재미없음 아무리 부산행이 한국최초 좀비 타이틀덕보고 흥행햇다쳐도 부산행이 더 재밋음.늘어지고 집중도 안됨1편은 좀비가 부각 됫으면2편은 그냥 차로 밀고 밟고 총으로 쏘고 끝.긴장감이라곤 없음사람들이 평점 낮게 준다면 그사람들이 제대로 보고 느낀대로 적은것임"
"240","어벤져스: 엔드게임","10","2019년 본영화 2"
"241","미스 스티븐스","10","티모시땜에 봤는데 릴리 레이브의 연기에 반했다"
"242","루키스","1","역겨운 중국짱깨들의 sns중독영화"
"243","뮬란","10","실사 개망작때문에 머리 앓다가 무슈랑 샹 그리고 reflection이 너무 그리워서 원작 애니 봅니다. 원작 애니 뮬란 감동은 그대로다. 내 최애 디즈니 영화.  실사 다시 만들어줬으면 ㅠ 너무 중국입맛에 맞췄다~~ 절대 안봐ㅠ"
"244","나를 구하지 마세요","10","애써 담담한척 괜찮은척하는 모녀가 힘냈으면.."
"245","캣츠","2","진짜 불면증 치료제 될 수 있을거 같음"
"246","다이너소어","10","컴공과라 울면서 봤다 ㄹㅇ 당시 영상미와 웅장하고 화려한 OST에 경의를 표한다."
"247","아오하라이드","5","왠지 모를 어색함 연기가 좀 그렇네"
"248","내부자들","1","너무 현실 반영을 못했다."
"249","다만 악에서 구하소서","10","졸잼 졸잼 졸잼 졸잼 조올잼"
"250","영웅: 샐러멘더의 비밀","10","선 평점,  후 감상평점보니 기대중입니다"
